{
  "schema_version": "env-check-0.1.0",
  "checked_at": "2026-07-04T12:00:00+08:00",
  "workbench": {
    "tool_matrix_version": "tool-matrix-0.1.0",
    "tool_matrix_path": "env/TOOL_MATRIX.yaml",
    "env_check_mode": "core_only",
    "debug_enabled": false,
    "notes": [
      "This is an example file. It does not represent a real machine.",
      "Local real env-check results should use *.local.json and must not be committed."
    ]
  },
  "host": {
    "os": "macos",
    "os_version": "example",
    "arch": "arm64",
    "shell": "zsh",
    "path_separator": ":",
    "path_entries_count": 12,
    "home_path_record_policy": "redacted",
    "runtime_context": "user"
  },
  "summary": {
    "status": "degraded",
    "core_ready": true,
    "available_tools": 9,
    "missing_tools": 1,
    "blocked_tools": 0,
    "skipped_tools": 0,
    "error_tools": 0,
    "required_for_workbench_missing": [],
    "recommended_missing": [
      "tar"
    ],
    "confirmation_items": []
  },
  "tools": {
    "git": {
      "tool_id": "git",
      "display_name": "Git",
      "category": "core",
      "required_level": "required_for_workbench",
      "status": "available",
      "missing_policy": "block_workbench",
      "version": "git version 2.x.x",
      "version_ok": true,
      "resolved_command": "git",
      "resolved_path": "/usr/bin/git",
      "resolved_path_redacted": "<SYSTEM_PATH>/git",
      "install_scope": "system",
      "manager": "system",
      "instances": [
        {
          "instance_id": "git-system-001",
          "command": "git",
          "path": "/usr/bin/git",
          "path_redacted": "<SYSTEM_PATH>/git",
          "version": "git version 2.x.x",
          "manager": "system",
          "install_scope": "system",
          "is_active": true,
          "extra": {}
        }
      ],
      "active_instance_id": "git-system-001",
      "detection_records": [
        {
          "command": "git --version",
          "command_redacted": "git --version",
          "exit_code": 0,
          "status": "success",
          "stdout_summary": "git version 2.x.x",
          "stderr_summary": null,
          "duration_ms": 12,
          "notes": []
        },
        {
          "command": "command -v git",
          "command_redacted": "command -v git",
          "exit_code": 0,
          "status": "success",
          "stdout_summary": "/usr/bin/git",
          "stderr_summary": null,
          "duration_ms": 5,
          "notes": []
        }
      ],
      "permissions": {
        "read_project": true,
        "write_project": false,
        "write_run_output": false,
        "write_cache": true,
        "network": false,
        "start_service": false,
        "dynamic_request": false,
        "reverse_artifact": false,
        "upload_external": false,
        "write_external": false
      },
      "missing_impact": null,
      "blocked_reason": null,
      "skipped_reason": null,
      "install_recommendation_ref": "env/INSTALL_GUIDE.md#3-macos-安装建议",
      "notes": []
    },
    "rg": {
      "tool_id": "rg",
      "display_name": "ripgrep",
      "category": "core",
      "required_level": "required_for_workbench",
      "status": "available",
      "missing_policy": "block_workbench",
      "version": "ripgrep 14.x.x",
      "version_ok": true,
      "resolved_command": "rg",
      "resolved_path": "/opt/homebrew/bin/rg",
      "resolved_path_redacted": "<USER_TOOL_PATH>/rg",
      "install_scope": "user",
      "manager": "brew",
      "instances": [
        {
          "instance_id": "rg-user-001",
          "command": "rg",
          "path": "/opt/homebrew/bin/rg",
          "path_redacted": "<USER_TOOL_PATH>/rg",
          "version": "ripgrep 14.x.x",
          "manager": "brew",
          "install_scope": "user",
          "is_active": true,
          "extra": {}
        }
      ],
      "active_instance_id": "rg-user-001",
      "detection_records": [
        {
          "command": "rg --version",
          "command_redacted": "rg --version",
          "exit_code": 0,
          "status": "success",
          "stdout_summary": "ripgrep 14.x.x",
          "stderr_summary": null,
          "duration_ms": 10,
          "notes": []
        },
        {
          "command": "command -v rg",
          "command_redacted": "command -v rg",
          "exit_code": 0,
          "status": "success",
          "stdout_summary": "/opt/homebrew/bin/rg",
          "stderr_summary": null,
          "duration_ms": 4,
          "notes": []
        }
      ],
      "permissions": {
        "read_project": true,
        "write_project": false,
        "write_run_output": true,
        "write_cache": true,
        "network": false,
        "start_service": false,
        "dynamic_request": false,
        "reverse_artifact": false,
        "upload_external": false,
        "write_external": false
      },
      "missing_impact": null,
      "blocked_reason": null,
      "skipped_reason": null,
      "install_recommendation_ref": "env/INSTALL_GUIDE.md#3-macos-安装建议",
      "notes": []
    },
    "python3": {
      "tool_id": "python3",
      "display_name": "Python 3",
      "category": "core",
      "required_level": "required_for_workbench",
      "status": "available_multiple",
      "missing_policy": "block_workbench",
      "version": "Python 3.11.x",
      "version_ok": true,
      "resolved_command": "python3",
      "resolved_path": "/Users/example/.local/share/mise/installs/python/3.11/bin/python3",
      "resolved_path_redacted": "<LOCAL_USER_PATH>/.local/share/mise/installs/python/3.11/bin/python3",
      "install_scope": "user",
      "manager": "mise",
      "instances": [
        {
          "instance_id": "python3-mise-311",
          "command": "python3",
          "path": "/Users/example/.local/share/mise/installs/python/3.11/bin/python3",
          "path_redacted": "<LOCAL_USER_PATH>/.local/share/mise/installs/python/3.11/bin/python3",
          "version": "Python 3.11.x",
          "manager": "mise",
          "install_scope": "user",
          "is_active": true,
          "extra": {
            "python_major": "3",
            "python_minor": "11"
          }
        },
        {
          "instance_id": "python3-system-001",
          "command": "python3",
          "path": "/usr/bin/python3",
          "path_redacted": "<SYSTEM_PATH>/python3",
          "version": "Python 3.x",
          "manager": "system",
          "install_scope": "system",
          "is_active": false,
          "extra": {}
        }
      ],
      "active_instance_id": "python3-mise-311",
      "detection_records": [
        {
          "command": "python3 --version",
          "command_redacted": "python3 --version",
          "exit_code": 0,
          "status": "success",
          "stdout_summary": "Python 3.11.x",
          "stderr_summary": null,
          "duration_ms": 9,
          "notes": []
        },
        {
          "command": "command -v python3",
          "command_redacted": "command -v python3",
          "exit_code": 0,
          "status": "success",
          "stdout_summary": "/Users/example/.local/share/mise/installs/python/3.11/bin/python3",
          "stderr_summary": null,
          "duration_ms": 5,
          "notes": [
            "Path is redacted in business-facing outputs."
          ]
        }
      ],
      "permissions": {
        "read_project": true,
        "write_project": false,
        "write_run_output": true,
        "write_cache": true,
        "network": false,
        "start_service": false,
        "dynamic_request": false,
        "reverse_artifact": false,
        "upload_external": false,
        "write_external": false
      },
      "missing_impact": null,
      "blocked_reason": null,
      "skipped_reason": null,
      "install_recommendation_ref": "env/INSTALL_GUIDE.md#3-macos-安装建议",
      "notes": [
        "Multiple Python instances detected. Active instance is managed by mise."
      ]
    },
    "bash": {
      "tool_id": "bash",
      "display_name": "Bash",
      "category": "core",
      "required_level": "required_for_workbench",
      "status": "available",
      "missing_policy": "block_workbench",
      "version": "GNU bash, version 5.x.x",
      "version_ok": true,
      "resolved_command": "bash",
      "resolved_path": "/opt/homebrew/bin/bash",
      "resolved_path_redacted": "<USER_TOOL_PATH>/bash",
      "install_scope": "user",
      "manager": "brew",
      "instances": [
        {
          "instance_id": "bash-user-001",
          "command": "bash",
          "path": "/opt/homebrew/bin/bash",
          "path_redacted": "<USER_TOOL_PATH>/bash",
          "version": "GNU bash, version 5.x.x",
          "manager": "brew",
          "install_scope": "user",
          "is_active": true,
          "extra": {}
        }
      ],
      "active_instance_id": "bash-user-001",
      "detection_records": [
        {
          "command": "bash --version",
          "command_redacted": "bash --version",
          "exit_code": 0,
          "status": "success",
          "stdout_summary": "GNU bash, version 5.x.x",
          "stderr_summary": null,
          "duration_ms": 8,
          "notes": []
        },
        {
          "command": "command -v bash",
          "command_redacted": "command -v bash",
          "exit_code": 0,
          "status": "success",
          "stdout_summary": "/opt/homebrew/bin/bash",
          "stderr_summary": null,
          "duration_ms": 4,
          "notes": []
        }
      ],
      "permissions": {
        "read_project": true,
        "write_project": false,
        "write_run_output": true,
        "write_cache": true,
        "network": false,
        "start_service": false,
        "dynamic_request": false,
        "reverse_artifact": false,
        "upload_external": false,
        "write_external": false
      },
      "missing_impact": null,
      "blocked_reason": null,
      "skipped_reason": null,